{
  "schema": "https://bukit.dev/schemas/publish-audit-report.v1.json",
  "schemaVersion": "1.0",
  "generatedAt": "2026-06-07T15:41:59.582696+00:00",
  "siteName": "starter",
  "siteUrl": "https://example.com",
  "baseUrl": "/",
  "documents": [
    {
      "routeUrl": "/",
      "outputPath": "index.html",
      "canonical": "https://example.com/",
      "indexable": true,
      "lastModified": "2026-06-07T15:41:59.392388+00:00",
      "contentType": "list",
      "sourceItemId": null,
      "title": "Bukit Starter",
      "description": "A content-first starter theme for Markdown and Notion sites.",
      "language": null,
      "author": null,
      "organization": null,
      "source": null,
      "originalSource": null,
      "reviewStatus": null,
      "summary": null,
      "updatedAt": null,
      "sourceReferences": [],
      "entityNames": [],
      "entitySummaries": [],
      "representationKinds": [
        "html",
        "semantic-html",
        "json",
        "markdown",
        "jsonld",
        "search",
        "sitemap",
        "llms",
        "agent-manifest"
      ],
      "representations": [
        {
          "kind": "html",
          "url": "/",
          "path": "index.html",
          "generated": true,
          "indexable": true
        },
        {
          "kind": "semantic-html",
          "url": "/",
          "path": "index.html",
          "generated": true,
          "indexable": true
        },
        {
          "kind": "json",
          "url": "/",
          "path": "",
          "generated": false,
          "indexable": true
        },
        {
          "kind": "markdown",
          "url": "/",
          "path": "",
          "generated": false,
          "indexable": true
        },
        {
          "kind": "jsonld",
          "url": "https://example.com/",
          "path": "",
          "generated": false,
          "indexable": true
        },
        {
          "kind": "search",
          "url": "/search.json",
          "path": "search.json",
          "generated": true,
          "indexable": true
        },
        {
          "kind": "sitemap",
          "url": "/sitemap.xml",
          "path": "sitemap.xml",
          "generated": true,
          "indexable": true
        },
        {
          "kind": "llms",
          "url": "/llms.txt",
          "path": "llms.txt",
          "generated": true,
          "indexable": true
        },
        {
          "kind": "agent-manifest",
          "url": "/agent-manifest.json",
          "path": "agent-manifest.json",
          "generated": true,
          "indexable": true
        }
      ],
      "schemaTypes": [
        "SearchAction",
        "WebPage",
        "WebSite"
      ],
      "structuredDataTypes": [
        "SearchAction",
        "WebPage",
        "WebSite"
      ],
      "semanticOutline": [
        {
          "level": 1,
          "text": "Bukit Starter"
        },
        {
          "level": 2,
          "text": "Latest content"
        },
        {
          "level": 2,
          "text": "About"
        },
        {
          "level": 2,
          "text": "Hello World"
        }
      ],
      "sitemapIncluded": true,
      "searchIncluded": true,
      "rssIncluded": false,
      "atomFeedIncluded": false,
      "jsonFeedIncluded": false,
      "llmsIncluded": true,
      "llmsFullIncluded": false,
      "robotsIncluded": false,
      "manifestIncluded": true
    },
    {
      "routeUrl": "/about/",
      "outputPath": "about/index.html",
      "canonical": "https://example.com/about/",
      "indexable": true,
      "lastModified": "2026-06-07T15:36:31.4636429+00:00",
      "contentType": "about",
      "sourceItemId": "about",
      "title": "\u5173\u4E8E - Bukit \u793A\u4F8B\u7AD9\u70B9",
      "description": "\u793A\u4F8B\u7AD9\u70B9\u8BF4\u660E",
      "language": "zh-CN",
      "author": null,
      "organization": null,
      "source": "markdown",
      "originalSource": null,
      "reviewStatus": "published",
      "summary": "\u793A\u4F8B\u7AD9\u70B9\u8BF4\u660E",
      "updatedAt": null,
      "sourceReferences": [],
      "entityNames": [],
      "entitySummaries": [],
      "representationKinds": [
        "html",
        "semantic-html",
        "json",
        "markdown",
        "jsonld",
        "search",
        "sitemap",
        "llms",
        "agent-manifest"
      ],
      "representations": [
        {
          "kind": "html",
          "url": "/about/",
          "path": "about/index.html",
          "generated": true,
          "indexable": true
        },
        {
          "kind": "semantic-html",
          "url": "/about/",
          "path": "about/index.html",
          "generated": true,
          "indexable": true
        },
        {
          "kind": "json",
          "url": "/content/about.json",
          "path": "content/about.json",
          "generated": true,
          "indexable": true
        },
        {
          "kind": "markdown",
          "url": "/content/about.md",
          "path": "content/about.md",
          "generated": true,
          "indexable": true
        },
        {
          "kind": "jsonld",
          "url": "https://example.com/about/",
          "path": "",
          "generated": false,
          "indexable": true
        },
        {
          "kind": "search",
          "url": "/search.json",
          "path": "search.json",
          "generated": true,
          "indexable": true
        },
        {
          "kind": "sitemap",
          "url": "/sitemap.xml",
          "path": "sitemap.xml",
          "generated": true,
          "indexable": true
        },
        {
          "kind": "llms",
          "url": "/llms.txt",
          "path": "llms.txt",
          "generated": true,
          "indexable": true
        },
        {
          "kind": "agent-manifest",
          "url": "/agent-manifest.json",
          "path": "agent-manifest.json",
          "generated": true,
          "indexable": true
        }
      ],
      "schemaTypes": [
        "BreadcrumbList",
        "ListItem",
        "SearchAction",
        "WebPage",
        "WebSite"
      ],
      "structuredDataTypes": [
        "BreadcrumbList",
        "ListItem",
        "SearchAction",
        "WebPage",
        "WebSite"
      ],
      "semanticOutline": [
        {
          "level": 1,
          "text": "About"
        },
        {
          "level": 1,
          "text": "About"
        }
      ],
      "sitemapIncluded": true,
      "searchIncluded": true,
      "rssIncluded": false,
      "atomFeedIncluded": false,
      "jsonFeedIncluded": false,
      "llmsIncluded": true,
      "llmsFullIncluded": false,
      "robotsIncluded": false,
      "manifestIncluded": true
    },
    {
      "routeUrl": "/blog/",
      "outputPath": "blog/index.html",
      "canonical": "https://example.com/blog/",
      "indexable": true,
      "lastModified": "1970-01-01T00:00:00+00:00",
      "contentType": "list",
      "sourceItemId": null,
      "title": "Blog",
      "description": "Browse Blog from Bukit Starter.",
      "language": null,
      "author": null,
      "organization": null,
      "source": null,
      "originalSource": null,
      "reviewStatus": null,
      "summary": null,
      "updatedAt": null,
      "sourceReferences": [],
      "entityNames": [],
      "entitySummaries": [],
      "representationKinds": [
        "html",
        "semantic-html",
        "json",
        "markdown",
        "jsonld",
        "search",
        "sitemap",
        "llms",
        "agent-manifest"
      ],
      "representations": [
        {
          "kind": "html",
          "url": "/blog/",
          "path": "blog/index.html",
          "generated": true,
          "indexable": true
        },
        {
          "kind": "semantic-html",
          "url": "/blog/",
          "path": "blog/index.html",
          "generated": true,
          "indexable": true
        },
        {
          "kind": "json",
          "url": "/blog/",
          "path": "",
          "generated": false,
          "indexable": true
        },
        {
          "kind": "markdown",
          "url": "/blog/",
          "path": "",
          "generated": false,
          "indexable": true
        },
        {
          "kind": "jsonld",
          "url": "https://example.com/blog/",
          "path": "",
          "generated": false,
          "indexable": true
        },
        {
          "kind": "search",
          "url": "/search.json",
          "path": "search.json",
          "generated": false,
          "indexable": true
        },
        {
          "kind": "sitemap",
          "url": "/sitemap.xml",
          "path": "sitemap.xml",
          "generated": true,
          "indexable": true
        },
        {
          "kind": "llms",
          "url": "/llms.txt",
          "path": "llms.txt",
          "generated": false,
          "indexable": true
        },
        {
          "kind": "agent-manifest",
          "url": "/agent-manifest.json",
          "path": "agent-manifest.json",
          "generated": false,
          "indexable": true
        }
      ],
      "schemaTypes": [
        "BreadcrumbList",
        "CollectionPage",
        "ListItem",
        "SearchAction",
        "WebSite"
      ],
      "structuredDataTypes": [
        "BreadcrumbList",
        "CollectionPage",
        "ListItem",
        "SearchAction",
        "WebSite"
      ],
      "semanticOutline": [
        {
          "level": 1,
          "text": "Blog"
        }
      ],
      "sitemapIncluded": true,
      "searchIncluded": false,
      "rssIncluded": false,
      "atomFeedIncluded": false,
      "jsonFeedIncluded": false,
      "llmsIncluded": false,
      "llmsFullIncluded": false,
      "robotsIncluded": false,
      "manifestIncluded": false
    },
    {
      "routeUrl": "/categories/",
      "outputPath": "categories/index.html",